{
  "schema": "cad-template/1",
  "template_id": "nozzle_contraction/1",
  "title": "axisymmetric subsonic contraction on +x",
  "axis": "+x",
  "units": "m",
  "params": [
    {
      "name": "D_i",
      "kind": "real",
      "unit": "m",
      "min": null,
      "max": null,
      "default_real": 0.06,
      "choices": [],
      "default_choice": null,
      "role": "intent",
      "only_when": null
    },
    {
      "name": "CR",
      "kind": "real",
      "unit": "1",
      "min": null,
      "max": null,
      "default_real": 9.0,
      "choices": [],
      "default_choice": null,
      "role": "intent",
      "only_when": null
    },
    {
      "name": "L_over_Di",
      "kind": "real",
      "unit": "1",
      "min": 0.5,
      "max": 1.5,
      "default_real": 1.0,
      "choices": [],
      "default_choice": null,
      "role": "design",
      "only_when": null
    },
    {
      "name": "law",
      "kind": "choice",
      "unit": "1",
      "min": null,
      "max": null,
      "default_real": null,
      "choices": [
        "poly3",
        "poly5",
        "poly7",
        "cubic_matched"
      ],
      "default_choice": "poly5",
      "role": "design",
      "only_when": null
    },
    {
      "name": "x_m",
      "kind": "real",
      "unit": "1",
      "min": 0.2,
      "max": 0.8,
      "default_real": 0.5,
      "choices": [],
      "default_choice": null,
      "role": "design",
      "only_when": "law=cubic_matched"
    },
    {
      "name": "Lx_over_De",
      "kind": "real",
      "unit": "1",
      "min": 0.25,
      "max": 1.0,
      "default_real": 0.5,
      "choices": [],
      "default_choice": null,
      "role": "design",
      "only_when": null
    },
    {
      "name": "Lu_over_Di",
      "kind": "real",
      "unit": "1",
      "min": 0.5,
      "max": 0.5,
      "default_real": 0.5,
      "choices": [],
      "default_choice": null,
      "role": "design",
      "only_when": null
    },
    {
      "name": "t_wall",
      "kind": "real",
      "unit": "m",
      "min": 0.001,
      "max": 0.01,
      "default_real": 0.003,
      "choices": [],
      "default_choice": null,
      "role": "design",
      "only_when": null
    }
  ],
  "planes": [
    {
      "name": "inlet",
      "description": "x = -Lu, the velocity inlet"
    },
    {
      "name": "contraction_start",
      "description": "x = 0, where the wall law starts"
    },
    {
      "name": "exit_plane",
      "description": "x = L, where the wall law ends"
    },
    {
      "name": "outlet",
      "description": "x = L + Lx, the pressure outlet"
    }
  ],
  "tags": [
    {
      "name": "inlet",
      "kind": "face",
      "description": "velocity inlet disc at x = -Lu"
    },
    {
      "name": "outlet",
      "kind": "face",
      "description": "pressure outlet disc at x = L + Lx"
    },
    {
      "name": "slip_upstream",
      "kind": "face",
      "description": "slip pipe from x = -Lu to x = 0"
    },
    {
      "name": "wall_contraction",
      "kind": "face",
      "description": "no-slip wall of the contraction law, x = 0 to L"
    },
    {
      "name": "wall_exit",
      "kind": "face",
      "description": "no-slip exit tube wall, x = L to L + Lx"
    },
    {
      "name": "wetted",
      "kind": "edge",
      "description": "meridian wetted curve: the law, then the exit tube"
    },
    {
      "name": "outer",
      "kind": "edge",
      "description": "meridian outer wall: the true normal offset of the wetted curve by t_wall"
    }
  ],
  "catalogue": [
    {
      "quantity": "inlet_diameter",
      "primitive": "diameter_at_plane",
      "where": [
        "contraction_start"
      ],
      "kind": "geometric",
      "method": "geometry",
      "unit": "m",
      "u_kind": "abs",
      "u_meas": 1e-09
    },
    {
      "quantity": "exit_diameter",
      "primitive": "diameter_at_plane",
      "where": [
        "exit_plane"
      ],
      "kind": "geometric",
      "method": "geometry",
      "unit": "m",
      "u_kind": "abs",
      "u_meas": 1e-09
    },
    {
      "quantity": "contraction_ratio",
      "primitive": "area_ratio",
      "where": [
        "contraction_start",
        "exit_plane"
      ],
      "kind": "geometric",
      "method": "geometry",
      "unit": "1",
      "u_kind": "rel",
      "u_meas": 1e-09
    },
    {
      "quantity": "total_length",
      "primitive": "extent_along_axis",
      "where": [
        "body"
      ],
      "kind": "geometric",
      "method": "geometry",
      "unit": "m",
      "u_kind": "abs",
      "u_meas": 1e-09
    },
    {
      "quantity": "contraction_length",
      "primitive": "plane_distance",
      "where": [
        "contraction_start",
        "exit_plane"
      ],
      "kind": "geometric",
      "method": "geometry",
      "unit": "m",
      "u_kind": "abs",
      "u_meas": 1e-09
    },
    {
      "quantity": "min_wall_normal",
      "primitive": "meridian_min_wall",
      "where": [
        "wetted",
        "outer"
      ],
      "kind": "geometric",
      "method": "geometry",
      "unit": "m",
      "u_kind": "abs",
      "u_meas": 1e-08
    },
    {
      "quantity": "max_wall_slope",
      "primitive": "slope_max",
      "where": [
        "wall_contraction"
      ],
      "kind": "geometric",
      "method": "geometry",
      "unit": "rad",
      "u_kind": "rel",
      "u_meas": 1e-06
    },
    {
      "quantity": "min_curvature_radius",
      "primitive": "curvature_radius_min",
      "where": [
        "wall_contraction"
      ],
      "kind": "geometric",
      "method": "geometry",
      "unit": "m",
      "u_kind": "rel",
      "u_meas": 1e-06
    },
    {
      "quantity": "n_solids",
      "primitive": "n_solids",
      "where": [
        "fluid"
      ],
      "kind": "geometric",
      "method": "geometry",
      "unit": "1",
      "u_kind": "exact",
      "u_meas": 0.0
    },
    {
      "quantity": "valid",
      "primitive": "valid",
      "where": [
        "fluid"
      ],
      "kind": "geometric",
      "method": "geometry",
      "unit": "1",
      "u_kind": "exact",
      "u_meas": 0.0
    }
  ],
  "profile_rules": [
    "PRF-BOX",
    "PRF-RMIN",
    "PRF-MONO",
    "PRF-DERIV",
    "PRF-SELFX",
    "PRF-FACE2D"
  ]
}
